VARIABLE;DATABASE;TYPE;NA_PERCENT;SUMMARY;DESCRIPTION
ORDER;General;character;0;;Valid order according to WoRMS (2025)
FAMILY;General;character;0;;Valid family according to WoRMS (2025)
GENUS;General;character;2.6;;Valid genus according to WoRMS (2025)
VALID_NAME;General;character;4.4;;Valid species according to WoRMS (2025)
APHIA_ID;General;character;0;;WoRMS aphia ID of the valid species name (2025)
AUTHORITY;General;character;0;;Authority (description study) of the valid species from WoRMS
ORIGINAL_NAME;General;character;0;;Original species name in the source study
EXT_REF;General;character;78.8;;Source study of the information cited in the main reference (given as 'AUTHORS, DATE')
REFERENCE;General;character;NA;;Main reference from which the information has been retrieved (given as 'AUTHORS (DATE) - JOURNAL')
LINK;General;character;2.4;;URL or DOI to access easily the main reference
ORIGIN;Larval growth rate;categorical;0;"Categories: Reared; Wild";Whether growth was estimated from reared or wild individuals
METHOD;Larval growth rate;categorical;0;"Categories: Otolithometry; Rearing; Rearing (age-length relationship) and otolithometry (wild age)";Methodology used to determine the age-length relationship
AGE;Larval growth rate;numeric;0.2;Mean: 18.41, Range: 0.00 - 270.00;Age of larvae in days post-hatch (DPH)
LENGTH;Larval growth rate;numeric;2.7;Mean: 10.45, Range: 0.01 - 256.80;Length measurement of larvae (in mm) associated with a specific age
WEIGHT;Larval growth rate;numeric;97.8;Mean: 13.69, Range: 0.00 - 660.00;Weight measurement of larvae (in mg) associated with a specific age
LENGTH_TYPE;Larval growth rate;categorical;0;"Categories: SL; TL";Type of length measurement: SL (Standard Length) or TL (Total Length)
WEIGHT_TYPE;Larval growth rate;categorical;0;"Categories: DW; WW";Type of weight measurement: WW (Wet Weight) or DW (Dry Weight)
TEMPERATURE_MEAN;Larval growth rate;numeric;12.7;Mean: 20.36, Range: 2.00 - 32.00;Mean (or midrange) temperature (in °C) from hatching to metamorphosis for reared individuals
TEMPERATURE_MIN;Larval growth rate;numeric;31.3;Mean: 18.78, Range: 3.10 - 30.20;Minimum temperature (in °C) from hatching to metamorphosis for reared individuals
TEMPERATURE_MAX;Larval growth rate;numeric;31.3;Mean: 21.81, Range: 5.50 - 35.00;Maximum temperature (in °C) during rearing from hatching to metamorphosis for reared individuals
TEMPERATURE_MEAN_TYPE;Larval growth rate;categorical;11.8;"Categories: mean; midrange";Whether the mean temperature corresponds to the real mean provided in the source study, or a midrange computed from the min/max if the real mean is missing
REMARKS;Larval growth rate;character;71.1;;Additional notes on rearing methodologies or age estimation techniques
EGG_LOCATION;Egg/yolk/OG position/shape/size/volume;categorical;14.4;"Categories: Benthic; Benthic (mouth/pouch); Benthic (nest spawners); Benthic (scatterers); Live birth; Ovoviviparous; Pelagic; Pelagic (bubble nesters); Viviparous";Description of the position of eggs in the water column with general details given between parentheses
EGG_DETAILS;Egg/yolk/OG position/shape/size/volume;categorical;91.6;"Categories: Attached (suspended) eggs; Attached and sinking eggs; Attached egg; Attached eggs; Attached on parent; Bathypelagic eggs; Buried; Egg raft; Eggs inside another animal; Mesopelagic eggs; Mesopelagic or bathypelagic eggs; Mouthbrooded; Not attached and sinking; Pouchbrooded; Probably attached";Additional description of the position of eggs in the water column with more details
EGG_SHAPE;Egg/yolk/OG position/shape/size/volume;categorical;58.6;"Categories: not-spherical; spherical";Shape of the egg determining if columns starting by EGG_L and columns starting by EGG_W are equal (spherical) or not (not-spherical)
EGG_L_MEAN;Egg/yolk/OG position/shape/size/volume;numeric;64.1;Mean: 1.46, Range: 0.15 - 20.50;Mean length (or diameter if spherical) of the egg (in mm)
EGG_L_MIN;Egg/yolk/OG position/shape/size/volume;numeric;79.7;Mean: 1.28, Range: 0.00 - 15.00;Minimum length (or diameter if spherical) of the egg (in mm)
EGG_L_MAX;Egg/yolk/OG position/shape/size/volume;numeric;79.7;Mean: 1.60, Range: 0.29 - 26.00;Maximum length (or diameter if spherical) of the egg (in mm)
EGG_W_MEAN;Egg/yolk/OG position/shape/size/volume;numeric;67.5;Mean: 1.31, Range: 0.20 - 20.50;Mean width (or diameter if spherical) of the egg (in mm)
EGG_W_MIN;Egg/yolk/OG position/shape/size/volume;numeric;81.1;Mean: 1.19, Range: 0.00 - 15.00;Minimum width (or diameter if spherical) of the egg (in mm)
EGG_W_MAX;Egg/yolk/OG position/shape/size/volume;numeric;81.1;Mean: 1.49, Range: 0.30 - 26.00;Maximum width (or diameter if spherical) of the egg (in mm)
EGG_L_MEAN_TYPE;Egg/yolk/OG position/shape/size/volume;categorical;64.1;"Categories: mean; midrange";Whether the mean egg length corresponds to the real mean provided in the source study, or a midrange computed from the min/max if the real mean is missing
EGG_W_MEAN_TYPE;Egg/yolk/OG position/shape/size/volume;categorical;67.5;"Categories: mean; midrange";Whether the mean egg width corresponds to the real mean provided in the source study, or a midrange computed from the min/max if the real mean is missing
EGG_DIAMETER_CONF;Egg/yolk/OG position/shape/size/volume;numeric;99.6;Mean: 0.04, Range: 0.00 - 0.30;Confidence interval relative to the mean egg length/width (generally the same for both, or mean between the two otherwise) in mm
EGG_DIAMETER_CONF_TYPE;Egg/yolk/OG position/shape/size/volume;categorical;99.6;"Categories: SD; SE";"Indicates whether the confidence interval is a standard deviation (SD), a standard error (SE), a coefficient of variation (CV), or the mean difference between actual 95% confidence intervals with the mean (CI). In case the type was not indicated in the source article when given after ""+/-"", it was assumed to be an SD."
YOLK_SIZE_MEAN;Egg/yolk/OG position/shape/size/volume;numeric;94.7;Mean: 1.24, Range: 0.27 - 16.53;Mean length (or diameter if spherical) of the yolk within the egg (in mm)
YOLK_SIZE_MIN;Egg/yolk/OG position/shape/size/volume;numeric;99.3;Mean: 1.15, Range: 0.30 - 2.20;Minimum length (or diameter if spherical) of the yolk within the egg (in mm)
YOLK_SIZE_MAX;Egg/yolk/OG position/shape/size/volume;numeric;99.3;Mean: 1.41, Range: 0.50 - 2.80;Maximum length (or diameter if spherical) of the yolk within the egg (in mm)
YOLK_SIZE_MEAN_TYPE;Egg/yolk/OG position/shape/size/volume;categorical;94.7;"Categories: mean; midrange";Whether the mean yolk diameter corresponds to the real mean provided in the source study, or a midrange computed from the min/max if the real mean is missing
NB_OIL_GLOBULE;Egg/yolk/OG position/shape/size/volume;character;85.1;;Number or range of oil globule(s) present in the egg. Temporal changes in the number of oil globules (e.g., multiple globules merging into one) were reported as a range.
OIL_GLOBULE_SIZE_MEAN;Egg/yolk/OG position/shape/size/volume;numeric;90.6;Mean: 0.25, Range: 0.02 - 3.45;Mean length (or diameter if spherical) of the oil globule in the egg (in mm)
OIL_GLOBULE_SIZE_MIN;Egg/yolk/OG position/shape/size/volume;numeric;93.5;Mean: 0.21, Range: 0.01 - 3.00;Minimum length (or diameter if spherical) of the oil globule in the egg (in mm)
OIL_GLOBULE_SIZE_MAX;Egg/yolk/OG position/shape/size/volume;numeric;93.5;Mean: 0.30, Range: 0.05 - 6.00;Maximum length (or diameter if spherical) of the oil globule in the egg (in mm)
OIL_GLOBULE_SIZE_MEAN_TYPE;Egg/yolk/OG position/shape/size/volume;categorical;90.9;"Categories: mean; midrange";Whether the mean oil globule diameter corresponds to the real mean provided in the source study, or a midrange computed from the min/max if the real mean is missing
EGG_VOLUME_MEAN;Egg/yolk/OG position/shape/size/volume;numeric;67;Mean: 8.53, Range: 0.00 - 4510.87;"Mean egg volume in mm3. If not already provided in the source study, it was computed as ""(4/3) * pi * (EGG_L_MEAN/2)^3"" for spherical eggs, or as ""(4/3) * pi * (EGG_L_MEAN/2) * (EGG_W_MEAN/2) * (EGG_W_MEAN/2))"" for non-spherical eggs"
EGG_VOLUME_MIN;Egg/yolk/OG position/shape/size/volume;numeric;81;Mean: 4.75, Range: 0.00 - 1767.15;Minimum egg volume in mm3. If not already provided in the source study, it was computed similarly to EGG_VOLUME_MEAN but considering EGG_L_MIN and EGG_W_MIN
EGG_VOLUME_MAX;Egg/yolk/OG position/shape/size/volume;numeric;81;Mean: 12.87, Range: 0.02 - 9202.77;Maximum egg volume in mm3. If not already provided in the source study, it was computed similarly to EGG_VOLUME_MEAN but considering EGG_L_MAX and EGG_W_MAX
EGG_VOLUME_TYPE;Egg/yolk/OG position/shape/size/volume;categorical;34.1;"Categories: Inferred from diameter; Inferred from diameter (min/max_diam = mean +/- 2 * SD); Original data";Whether the egg volume corresponds to measured data or was inferred from radius (specifying that if the range was missing, it was inferred using the SD)
YOLK_VOLUME_MEAN;Egg/yolk/OG position/shape/size/volume;numeric;94.7;Mean: 12.11, Range: 0.01 - 2364.92;"Mean yolk volume in mm3. It was computed considering the yolk in the egg is spherical: ""(4/3) * pi * (EGG_L_MEAN/2)^3""."
YOLK_VOLUME_MIN;Egg/yolk/OG position/shape/size/volume;numeric;99.3;Mean: 1.34, Range: 0.01 - 5.58;"Minimum yolk volume in mm3. It was computed considering the yolk in the egg is spherical: ""(4/3) * pi * (EGG_L_MEAN/2)^3""."
YOLK_VOLUME_MAX;Egg/yolk/OG position/shape/size/volume;numeric;99.3;Mean: 2.37, Range: 0.06 - 11.49;"Maximum yolk volume in mm3. It was computed considering the yolk in the egg is spherical: ""(4/3) * pi * (EGG_L_MEAN/2)^3""."
YOLK_VOLUME_TYPE;Egg/yolk/OG position/shape/size/volume;categorical;94.7;Categories: Inferred from diameter (assuming yolk is spherical);Column precising whether the yolk volume was inferred from diameter (assuming it was spherical) or it was directly provided
OIL_GLOBULE_VOLUME_MEAN;Egg/yolk/OG position/shape/size/volume;numeric;89.5;Mean: 0.03, Range: 0.00 - 17.16;"Mean oil globule volume in egg (in mm3). It was computed if there was only 1 oil globule, considering it is spherical: ""(4/3) * pi * (EGG_L_MEAN/2)^3""."
OIL_GLOBULE_VOLUME_MIN;Egg/yolk/OG position/shape/size/volume;numeric;95.9;Mean: 0.01, Range: 0.00 - 0.66;"Minimum oil globule volume in egg (in mm3). It was computed if there was only 1 oil globule, considering it is spherical: ""(4/3) * pi * (EGG_L_MEAN/2)^3""."
OIL_GLOBULE_VOLUME_MAX;Egg/yolk/OG position/shape/size/volume;numeric;95.9;Mean: 0.02, Range: 0.00 - 1.32;"Maximum oil globule volume in egg (in mm3). It was computed if there was only 1 oil globule, considering it is spherical: ""(4/3) * pi * (EGG_L_MEAN/2)^3""."
OIL_GLOBULE_VOLUME_TYPE;Egg/yolk/OG position/shape/size/volume;categorical;89.5;Categories: Inferred from diameter (0 or 1 oil globule);Column specifying whether the oil globule volume was inferred from diameter or was directly provided.
INCUBATION_GESTATION_HOUR_MEAN;Incubation duration;numeric;0;Mean: 202.38, Range: 3.00 - 8760.00;Mean (or midrange) duration of incubation in egg or gestation (in hours)
INCUBATION_GESTATION_HOUR_MIN;Incubation duration;numeric;70.5;Mean: 162.07, Range: 11.00 - 7200.00;Minimum duration of incubation in egg or gestation (in hours)
INCUBATION_GESTATION_HOUR_MAX;Incubation duration;numeric;70.5;Mean: 237.52, Range: 14.00 - 8640.00;Maximum duration of incubation in egg or gestation (in hours)
INCUBATION_GESTATION_HOUR_MEAN_TYPE;Incubation duration;categorical;0;"Categories: mean; midrange";Indicates whether the mean incubation/gestation duration is a real mean or a midrange computed from min/max values
INCUBATION_GESTATION_TEMPERATURE_MEAN;Incubation duration;numeric;26.7;Mean: 20.76, Range: -1.00 - 30.50;Mean (or midrange) temperature (in °C) during incubation or gestation period
INCUBATION_GESTATION_TEMPERATURE_MIN;Incubation duration;numeric;80;Mean: 21.52, Range: 1.20 - 30.20;Minimum temperature (in °C) during incubation or gestation period
INCUBATION_GESTATION_TEMPERATURE_MAX;Incubation duration;numeric;80.1;Mean: 23.90, Range: 1.60 - 32.00;Maximum temperature (in °C) during incubation or gestation period
INCUBATION_GESTATION_TEMPERATURE_MEAN_TYPE;Incubation duration;categorical;26.6;"Categories: mean; midrange";Indicates whether the mean temperature is a real mean or a midrange computed from min/max values
N;Hatching size;character;97;;Number of individuals measured for hatching size
HATCHING_SIZE_MEAN;Hatching size;numeric;0;Mean: 4.05, Range: 0.70-57.50;Mean (or midrange) size (in mm) at hatching or parturition
HATCHING_SIZE_MIN;Hatching size;numeric;58.3;Mean: 3.79, Range: 0.80 - 54.00;Minimum size (in mm) at hatching or parturition
HATCHING_SIZE_MAX;Hatching size;numeric;58.3;Mean: 4.62, Range: 0.98 - 61.00;Maximum size (in mm) at hatching or parturition
HATCHING_SIZE_CONF;Hatching size;numeric;96.6;Mean: 0.12, Range: 0.00 - 0.95;Confidence interval (in mm) associated with the mean hatching or parturition size
HATCHING_SIZE_CONF_TYPE;Hatching size;categorical;96.7;"Categories: SD; SE";"Indicates whether the confidence interval is a standard deviation (SD), a standard error (SE), a coefficient of variation (CV), or the mean difference between actual 95% confidence intervals with the mean (CI). In case the type was not indicated in the source article when given after ""+/-"", it was assumed to be an SD."
REARING_TEMPERATURE_MEAN;Hatching size;numeric;71.1;Mean: 22.28, Range: 2.50 - 34.00;Mean (or midrange) temperature (in °C) during the monitored larval period for rearing studies
REARING_TEMPERATURE_MIN;Hatching size;numeric;76.3;Mean: 22.17, Range: -1.00 - 34.00;Minimum temperature (in °C) during the monitored larval period for rearing studies
REARING_TEMPERATURE_MAX;Hatching size;numeric;88.8;Mean: 24.91, Range: 5.00 - 33.20;Maximum temperature (in °C) during the monitored larval period for rearing studies
REARING_TEMPERATURE_MEAN_TYPE;Hatching size;categorical;71.1;"Categories: mean; midrange";Indicates whether the mean rearing temperature is a real mean or a midrange computed from min/max values
N;Age at first feeding/yolk-absorption;numeric;97.5;Mean: 27.33, Range: 1.00 - 110.00;Number of individuals measured for age at first feeding or yolk absorption
REARING_TEMPERATURE_MEAN;Age at first feeding/yolk-absorption;numeric;17.2;Mean: 22.21, Range: 4.40 - 34.00;Mean (or midrange) temperature (in °C) during the monitored larval period for rearing studies
REARING_TEMPERATURE_MIN;Age at first feeding/yolk-absorption;numeric;32.9;Mean: 22.54, Range: 5.00 - 34.00;Minimum temperature (in °C) during the monitored larval period for rearing studies
REARING_TEMPERATURE_MAX;Age at first feeding/yolk-absorption;numeric;74.7;Mean: 25.65, Range: 7.00 - 32.00;Maximum temperature (in °C) during the monitored larval period for rearing studies
REARING_TEMPERATURE_MEAN_TYPE;Age at first feeding/yolk-absorption;categorical;17.2;"Categories: mean; midrange";Indicates whether the mean rearing temperature is a real mean or a midrange computed from min/max values
FIRST_FEEDING_DPH_MEAN;Age at first feeding/yolk-absorption;numeric;42;Mean: 3.43, Range: 0.00 - 40.00;Mean (or midrange) age (in days post-hatch) at first feeding (start of exogenous nutrition)
FIRST_FEEDING_DPH_MIN;Age at first feeding/yolk-absorption;numeric;82.8;Mean: 2.46, Range: 0.00 - 6.00;Minimum age (in days post-hatch) at first feeding (start of exogenous nutrition)
FIRST_FEEDING_DPH_MAX;Age at first feeding/yolk-absorption;numeric;82.8;Mean: 3.74, Range: 1.00 - 8.00;Maximum age (in days post-hatch) at first feeding (start of exogenous nutrition)
FIRST_FEEDING_DPH_MEAN_TYPE;Age at first feeding/yolk-absorption;categorical;42;"Categories: mean; midrange";Indicates whether the mean age at first feeding is a real mean or a midrange computed from min/max values
YOLK_ABSORPTION_DPH_MEAN;Age at first feeding/yolk-absorption;numeric;18.3;Mean: 5.08, Range: 0.00 - 56.00;Mean (or midrange) age (in days post-hatch) at yolk absorption (complete depletion of egg resources)
YOLK_ABSORPTION_DPH_MIN;Age at first feeding/yolk-absorption;numeric;84.5;Mean: 4.78, Range: 0.00 - 42.00;Minimum age (in days post-hatch) at yolk absorption (complete depletion of egg resources)
YOLK_ABSORPTION_DPH_MAX;Age at first feeding/yolk-absorption;numeric;84.5;Mean: 6.97, Range: 1.00 - 70.00;Maximum age (in days post-hatch) at yolk absorption (complete depletion of egg resources)
YOLK_ABSORPTION_MEAN_TYPE;Age at first feeding/yolk-absorption;categorical;18.3;"Categories: mean; midrange";Indicates whether the mean age at yolk absorption is a real mean or a midrange computed from min/max values
N;Size at first feeding/yolk-absorption;numeric;95.9;Mean: 22.50, Range: 1.00 - 110.00;Number of individuals measured for size at first feeding or yolk absorption
REARING_TEMPERATURE_MEAN;Size at first feeding/yolk-absorption;numeric;53.9;Mean: 25.13, Range: 9.70 - 29.75;Mean (or midrange) temperature (in °C) during the monitored larval period for rearing studies
REARING_TEMPERATURE_MIN;Size at first feeding/yolk-absorption;numeric;58.4;Mean: 23.83, Range: 8.20 - 29.00;Minimum temperature (in °C) during the monitored larval period for rearing studies
REARING_TEMPERATURE_MAX;Size at first feeding/yolk-absorption;numeric;58.8;Mean: 26.23, Range: 11.20 - 31.00;Maximum temperature (in °C) during the monitored larval period for rearing studies
REARING_TEMPERATURE_MEAN_TYPE;Size at first feeding/yolk-absorption;categorical;53.9;"Categories: mean; midrange";Indicates whether the mean rearing temperature is a real mean or a midrange computed from min/max values
FIRST_FEEDING_SIZE_MEAN;Size at first feeding/yolk-absorption;numeric;86;Mean: 2.78, Range: 1.50 - 5.00;Mean (or midrange) size (in mm) at first feeding (start of exogenous nutrition)
FIRST_FEEDING_SIZE_MIN;Size at first feeding/yolk-absorption;numeric;98.8;Mean: 2.94, Range: 2.20 - 4.24;Minimum size (in mm) at first feeding (start of exogenous nutrition)
FIRST_FEEDING_SIZE_MAX;Size at first feeding/yolk-absorption;numeric;98.8;Mean: 3.17, Range: 2.30 - 4.34;Maximum size (in mm) at first feeding (start of exogenous nutrition)
FIRST_FEEDING_SIZE_CONF;Size at first feeding/yolk-absorption;numeric;99.6;Mean: 3.16, Range: 3.16 - 3.16;Confidence interval (in mm) associated with the mean size at first feeding
FIRST_FEEDING_SIZE_MEAN_TYPE;Size at first feeding/yolk-absorption;categorical;85.6;"Categories: mean; midrange";Indicates whether the mean size at first feeding is a real mean or a midrange computed from min/max values
FIRST_FEEDING_SIZE_CONF_TYPE;Size at first feeding/yolk-absorption;categorical;100;;"Indicates whether the confidence interval is a standard deviation (SD), a standard error (SE), a coefficient of variation (CV), or the mean difference between actual 95% confidence intervals with the mean (CI). In case the type was not indicated in the source article when given after ""+/-"", it was assumed to be an SD."
YOLK_SAC_ABSORBED_SIZE_MEAN;Size at first feeding/yolk-absorption;numeric;13.2;Mean: 4.28, Range: 1.50 - 17.00;Mean (or midrange) size (in mm) at yolk sac absorption (complete depletion of egg resources)
YOLK_SAC_ABSORBED_SIZE_MIN;Size at first feeding/yolk-absorption;numeric;60.5;Mean: 4.27, Range: 1.97 - 16.00;Minimum size (in mm) at yolk sac absorption (complete depletion of egg resources)
YOLK_SAC_ABSORBED_SIZE_MAX;Size at first feeding/yolk-absorption;numeric;60.5;Mean: 4.82, Range: 2.19 - 18.00;Maximum size (in mm) at yolk sac absorption (complete depletion of egg resources)
YOLK_SAC_ABSORBED_SIZE_CONF;Size at first feeding/yolk-absorption;numeric;94.2;Mean: 0.11, Range: 0.03 - 0.19;Confidence interval (in mm) associated with the mean size at yolk sac absorption
YOLK_SAC_ABSORBED_SIZE_MEAN_TYPE;Size at first feeding/yolk-absorption;categorical;13.2;"Categories: mean; midrange";Indicates whether the mean size at yolk sac absorption is a real mean or a midrange computed from min/max values
YOLK_SAC_ABSORBED_SIZE_CONF_TYPE;Size at first feeding/yolk-absorption;categorical;94.2;Categories: SD;"Indicates whether the confidence interval is a standard deviation (SD), a standard error (SE), a coefficient of variation (CV), or the mean difference between actual 95% confidence intervals with the mean (CI). In case the type was not indicated in the source article when given after ""+/-"", it was assumed to be an SD."
N;Age at flexion;character;82.6;;Number of individuals measured for age at flexion
REARING_TEMPERATURE_MEAN;Age at flexion;numeric;36.2;Mean: 24.55, Range: 5.50 - 29.50;Mean (or midrange) temperature (in °C) during the monitored larval period for rearing studies
REARING_TEMPERATURE_MIN;Age at flexion;numeric;38.6;Mean: 23.67, Range: 5.00 - 29.50;Minimum temperature (in °C) during the monitored larval period for rearing studies
REARING_TEMPERATURE_MAX;Age at flexion;numeric;52.7;Mean: 25.95, Range: 6.00 - 33.20;Maximum temperature (in °C) during the monitored larval period for rearing studies
REARING_TEMPERATURE_MEAN_TYPE;Age at flexion;categorical;36.2;"Categories: mean; midrange";Indicates whether the mean rearing temperature is a real mean or a midrange computed from min/max values
FLEXION_INFOS;Age at flexion;categorical;72.5;"Categories: Age at the end of flexion; Age at the start of flexion; Age range from the start to the end of flexion; Age range of sampled individuals undergoing flexion";"Whether the age range corresponds to the start and/or end (""min(1st)-max(last)"" if precised that individual metamorphosis duration is unknown) of metamorphosis (""full range?"" if not sure) or the minimum and maximum ages across transforming individuals (possibly a conservative estimate of min/max from SD if range is not precised)"
FLEXION_AGE_DPH_MEAN;Age at flexion;numeric;0;Mean: 15.17, Range: 0.00 - 52.50;Mean (or midrange) age (in days post-hatch) at flexion (upward notochord bending associated with the ossification of fins)
FLEXION_AGE_DPH_MIN;Age at flexion;numeric;50.2;Mean: 13.05, Range: 2.00 - 49.00;Minimum age (in days post-hatch) at flexion (upward notochord bending associated with the ossification of fins)
FLEXION_AGE_DPH_MAX;Age at flexion;numeric;50.2;Mean: 18.47, Range: 5.00 - 60.00;Maximum age (in days post-hatch) at flexion (upward notochord bending associated with the ossification of fins)
FLEXION_AGE_DPH_MEAN_TYPE;Age at flexion;categorical;0;"Categories: mean; midrange";Indicates whether the mean age at flexion is a real mean or a midrange computed from min/max values
N;Size at flexion;character;96.9;;Number of individuals measured for size at flexion
LENGTH_TYPE;Size at flexion;categorical;2.4;"Categories: NL; SL; TL";Type of length measurement: NL (Notochord Length), SL (Standard Length), or TL (Total Length)
REARING_TEMPERATURE_MEAN;Size at flexion;numeric;94.1;Mean: 24.09, Range: 5.50 - 30.24;Mean (or midrange) temperature (in °C) during the monitored larval period for rearing studies
REARING_TEMPERATURE_MIN;Size at flexion;numeric;95.2;Mean: 22.95, Range: 5.00 - 30.20;Minimum temperature (in °C) during the monitored larval period for rearing studies
REARING_TEMPERATURE_MAX;Size at flexion;numeric;95.2;Mean: 25.42, Range: 6.00 - 33.20;Maximum temperature (in °C) during the monitored larval period for rearing studies
REARING_TEMPERATURE_MEAN_TYPE;Size at flexion;categorical;94.1;"Categories: mean; midrange";Indicates whether the mean rearing temperature is a real mean or a midrange computed from min/max values
FLEXION_INFOS;Size at flexion;categorical;89.4;"Categories: Size at the end of flexion; Size at the start of flexion; Size range (based on mean +/- SD) of sampled individuals undergoing flexion; Size range (based on quartiles) of sampled individuals undergoing flexion; Size range from the start to the end of flexion; Size range of sampled individuals undergoing flexion";"Whether the age range corresponds to the start and/or end (""min(1st)-max(last)"" if precised that individual metamorphosis duration is unknown) of metamorphosis (""full range?"" if not sure) or the minimum and maximum ages across transforming individuals (possibly a conservative estimate of min/max from SD if range is not precised)"
FLEXION_PARTICULARITY;Size at flexion;categorical;96.7;"Categories: Does not occur; Flexion prior to hatching";Indicates any particularities related to flexion, such as its absence or occurrence before hatching
FLEXION_SIZE_MEAN;Size at flexion;numeric;0.4;Mean: 7.49, Range: 2.00 - 32.00;Mean (or midrange) size (in mm) at flexion (upward notochord bending associated with the ossification of fins)
FLEXION_SIZE_MIN;Size at flexion;numeric;31.5;Mean: 6.37, Range: 2.00 - 28.00;Minimum size (in mm) at flexion (upward notochord bending associated with the ossification of fins)
FLEXION_SIZE_MAX;Size at flexion;numeric;31.5;Mean: 8.83, Range: 2.80 - 52.10;Maximum size (in mm) at flexion (upward notochord bending associated with the ossification of fins)
FLEXION_SIZE_CONF;Size at flexion;numeric;99.1;Mean: 0.21, Range: 0.01 - 0.66;Confidence interval (in mm) associated with the mean size at flexion
FLEXION_SIZE_MEAN_TYPE;Size at flexion;categorical;0.4;"Categories: mean; midrange";Indicates whether the mean size at flexion is a real mean or a midrange computed from min/max values
FLEXION_SIZE_CONF_TYPE;Size at flexion;categorical;99.1;"Categories: SD; SE";"Indicates whether the confidence interval is a standard deviation (SD), a standard error (SE), a coefficient of variation (CV), or the mean difference between actual 95% confidence intervals with the mean (CI). In case the type was not indicated in the source article when given after ""+/-"", it was assumed to be an SD."
N;Metamorphosis age/duration;character;85.7;;Number of individuals measured for metamorphosis age or duration
